{
  "slug": "a-leecon-gmbh",
  "name": "A-Leecon GmbH",
  "product_url": "https://leeon.com",
  "description": "German educational company focused on AI training (founded 2023)",
  "product_type": "other",
  "category": "ai-application",
  "status": "active",
  "meta": {
    "added_date": "2026-02-12",
    "last_updated": "2026-02-12",
    "provenance": {
      "name": {
        "source": "wikidata",
        "tier": 1,
        "confidence": 0.95,
        "updated_at": "2026-02-12"
      },
      "product_url": {
        "source": "wikidata",
        "tier": 1,
        "confidence": 0.95,
        "updated_at": "2026-02-12"
      },
      "description": {
        "source": "wikidata",
        "tier": 1,
        "confidence": 0.95,
        "updated_at": "2026-02-12"
      },
      "product_type": {
        "source": "wikidata",
        "tier": 1,
        "confidence": 0.95,
        "updated_at": "2026-02-12"
      },
      "category": {
        "source": "wikidata",
        "tier": 1,
        "confidence": 0.95,
        "updated_at": "2026-02-12"
      },
      "status": {
        "source": "wikidata",
        "tier": 1,
        "confidence": 0.95,
        "updated_at": "2026-02-12"
      },
      "company.name": {
        "source": "wikidata",
        "tier": 1,
        "confidence": 0.95,
        "updated_at": "2026-02-12"
      },
      "company.url": {
        "source": "wikidata",
        "tier": 1,
        "confidence": 0.95,
        "updated_at": "2026-02-12"
      },
      "company.website": {
        "source": "wikidata",
        "tier": 1,
        "confidence": 0.95,
        "updated_at": "2026-02-12"
      },
      "company.founded_year": {
        "source": "wikidata",
        "tier": 1,
        "confidence": 0.95,
        "updated_at": "2026-02-12"
      },
      "company.headquarters": {
        "source": "wikidata",
        "tier": 1,
        "confidence": 0.95,
        "updated_at": "2026-02-12"
      }
    }
  },
  "sources": [
    {
      "url": "https://www.wikidata.org/wiki/Q136813852",
      "source_name": "wikidata",
      "scraped_at": "2026-02-12"
    }
  ],
  "company": {
    "name": "A-Leecon GmbH",
    "url": "https://leeon.com",
    "website": "https://leeon.com",
    "founded_year": 2023,
    "headquarters": {
      "city": "Neulu√üheim",
      "country": "Germany",
      "country_code": "DE"
    }
  },
  "tags": [
    "europe",
    "consumers",
    "education-tutoring"
  ]
}
