{
  "slug": "in-the-wild-model-organisms",
  "name": "In-the-Wild Model Organisms",
  "product_url": "",
  "description": "We propose activation-based data attribution, a method that traces behavioral changes in post-trained language models to responsible training datapoints. By computing activation-difference vectors for both test prompts and preference pairs and ranking by cosine similarity, we identify datapoints that cause specific behaviors and validate these attributions causally by retraining with modified data. Clustering behavior-datapoint similarity matrices also enables unsupervised discovery of emergent behaviors. Applying this to OLMo 2's production DPO training, we surfaced distractor-triggered compliance: a harmful behavior where the model complies with dangerous requests when benign formatting instructions are appended. Filtering top-ranked datapoints reduces this behavior by 63% while switching their labels achieves 78%. Our method outperforms gradient-based attribution and LLM-judge baselines while being over 10 times cheaper than both. This in-the-wild model organism - emerging from contaminated preference data rather than deliberate injection - provides a realistic benchmark for safety techniques.",
  "product_type": "other",
  "category": "ai-foundation-model",
  "status": "active",
  "meta": {
    "added_date": "2026-02-13",
    "last_updated": "2026-02-12",
    "provenance": {
      "name": {
        "source": "arxiv",
        "tier": 2,
        "confidence": 0.75,
        "updated_at": "2026-02-13"
      },
      "description": {
        "source": "arxiv",
        "tier": 2,
        "confidence": 0.75,
        "updated_at": "2026-02-13"
      },
      "product_type": {
        "source": "arxiv",
        "tier": 2,
        "confidence": 0.75,
        "updated_at": "2026-02-13"
      },
      "category": {
        "source": "arxiv",
        "tier": 2,
        "confidence": 0.75,
        "updated_at": "2026-02-13"
      },
      "status": {
        "source": "arxiv",
        "tier": 2,
        "confidence": 0.75,
        "updated_at": "2026-02-13"
      },
      "company.name": {
        "source": "arxiv",
        "tier": 2,
        "confidence": 0.75,
        "updated_at": "2026-02-13"
      },
      "company.url": {
        "source": "arxiv",
        "tier": 2,
        "confidence": 0.75,
        "updated_at": "2026-02-13"
      },
      "tags": {
        "source": "arxiv",
        "tier": 2,
        "confidence": 0.75,
        "updated_at": "2026-02-13"
      },
      "key_people": {
        "source": "arxiv",
        "tier": 2,
        "confidence": 0.75,
        "updated_at": "2026-02-13"
      },
      "release_date": {
        "source": "arxiv",
        "tier": 2,
        "confidence": 0.75,
        "updated_at": "2026-02-13"
      }
    }
  },
  "sources": [
    {
      "url": "http://arxiv.org/abs/2602.11079v1",
      "source_name": "arxiv",
      "scraped_at": "2026-02-13"
    }
  ],
  "company": {
    "name": "In-the-Wild Model Organisms",
    "url": "https://www.bing.com/search?q=In-the-Wild+Model+Organisms+AI"
  },
  "tags": [
    "researchers",
    "research",
    "nlp",
    "embedding"
  ],
  "key_people": [
    {
      "name": "Frank Xiao",
      "title": "Author",
      "is_founder": false
    },
    {
      "name": "Santiago Aranguri",
      "title": "Author",
      "is_founder": false
    }
  ],
  "release_date": "2026-02-11"
}
