{
  "slug": "qwen-chatmo-xing-ti-yan-ping-tai",
  "name": "Qwen Chat模型体验平台",
  "product_url": "https://chat.qwen.ai",
  "description": "Qwen Chat是阿里通义推出的Qwen最新模型体验平台",
  "product_type": "app",
  "category": "ai-application",
  "status": "active",
  "meta": {
    "added_date": "2026-02-13",
    "last_updated": "2026-02-13",
    "provenance": {
      "name": {
        "source": "ainav",
        "tier": 2,
        "confidence": 0.75,
        "updated_at": "2026-02-13"
      },
      "product_url": {
        "source": "ainav",
        "tier": 2,
        "confidence": 0.75,
        "updated_at": "2026-02-13"
      },
      "description": {
        "source": "ainav",
        "tier": 2,
        "confidence": 0.75,
        "updated_at": "2026-02-13"
      },
      "product_type": {
        "source": "ainav",
        "tier": 2,
        "confidence": 0.75,
        "updated_at": "2026-02-13"
      },
      "category": {
        "source": "ainav",
        "tier": 2,
        "confidence": 0.75,
        "updated_at": "2026-02-13"
      },
      "status": {
        "source": "ainav",
        "tier": 2,
        "confidence": 0.75,
        "updated_at": "2026-02-13"
      },
      "name_zh": {
        "source": "ainav",
        "tier": 2,
        "confidence": 0.75,
        "updated_at": "2026-02-13"
      },
      "description_zh": {
        "source": "ainav",
        "tier": 2,
        "confidence": 0.75,
        "updated_at": "2026-02-13"
      },
      "company.name": {
        "source": "ainav",
        "tier": 2,
        "confidence": 0.75,
        "updated_at": "2026-02-13"
      },
      "company.url": {
        "source": "ainav",
        "tier": 2,
        "confidence": 0.75,
        "updated_at": "2026-02-13"
      },
      "icon_url": {
        "source": "ainav",
        "tier": 2,
        "confidence": 0.75,
        "updated_at": "2026-02-13"
      },
      "sub_category": {
        "source": "ainav",
        "tier": 2,
        "confidence": 0.75,
        "updated_at": "2026-02-13"
      },
      "tags": {
        "source": "ainav",
        "tier": 2,
        "confidence": 0.75,
        "updated_at": "2026-02-13"
      }
    }
  },
  "sources": [
    {
      "url": "https://www.ainav.cn/favorites/ai%E5%AF%B9%E8%AF%9D%E8%81%8A%E5%A4%A9",
      "source_name": "ainav",
      "scraped_at": "2026-02-13"
    }
  ],
  "name_zh": "Qwen Chat模型体验平台",
  "description_zh": "Qwen Chat是阿里通义推出的Qwen最新模型体验平台",
  "company": {
    "name": "Qwen Chat模型体验平台",
    "url": "https://www.bing.com/search?q=Qwen+Chat%E6%A8%A1%E5%9E%8B%E4%BD%93%E9%AA%8C%E5%B9%B3%E5%8F%B0+AI"
  },
  "icon_url": "https://www.ainav.cn/wp-content/uploads/2023/09/e7008-qianwen.aliyun.com.png",
  "sub_category": "voice-assistant",
  "tags": [
    "consumers"
  ]
}
