{
  "slug": "calliope",
  "name": "Calliope",
  "product_url": "",
  "description": "A narrated e-book combines synchronized audio with digital text, highlighting the currently spoken word or sentence during playback. This format supports early literacy and assists individuals with reading challenges, while also allowing general readers to seamlessly switch between reading and listening. With the emergence of natural-sounding neural Text-to-Speech (TTS) technology, several commercial services have been developed to leverage these technology for converting standard text e-books into high-quality narrated e-books. However, no open-source solutions currently exist to perform this task. In this paper, we present Calliope, an open-source framework designed to fill this gap. Our method leverages state-of-the-art open-source TTS to convert a text e-book into a narrated e-book in the EPUB 3 Media Overlay format. The method offers several innovative steps: audio timestamps are captured directly during TTS, ensuring exact synchronization between narration and text highlighting; the publisher's original typography, styling, and embedded media are strictly preserved; and the entire pipeline operates offline. This offline capability eliminates recurring API costs, mitigates privacy concerns, and avoids copyright compliance issues associated with cloud-based services. The framework currently supports the state-of-the-art open-source TTS systems XTTS-v2 and Chatterbox. A potential alternative approach involves first generating narration via TTS and subsequently synchronizing it with the text using forced alignment. However, while our method ensures exact synchronization, our experiments show that forced alignment introduces drift between the audio and text highlighting significant enough to degrade the reading experience. Source code and usage instructions are available at https://github.com/hugohammer/TTS-Narrated-Ebook-Creator.git.",
  "product_type": "other",
  "category": "ai-foundation-model",
  "status": "active",
  "meta": {
    "added_date": "2026-02-13",
    "last_updated": "2026-02-12",
    "provenance": {
      "name": {
        "source": "arxiv",
        "tier": 2,
        "confidence": 0.75,
        "updated_at": "2026-02-13"
      },
      "description": {
        "source": "arxiv",
        "tier": 2,
        "confidence": 0.75,
        "updated_at": "2026-02-13"
      },
      "product_type": {
        "source": "arxiv",
        "tier": 2,
        "confidence": 0.75,
        "updated_at": "2026-02-13"
      },
      "category": {
        "source": "arxiv",
        "tier": 2,
        "confidence": 0.75,
        "updated_at": "2026-02-13"
      },
      "status": {
        "source": "arxiv",
        "tier": 2,
        "confidence": 0.75,
        "updated_at": "2026-02-13"
      },
      "company.name": {
        "source": "arxiv",
        "tier": 2,
        "confidence": 0.75,
        "updated_at": "2026-02-13"
      },
      "company.url": {
        "source": "arxiv",
        "tier": 2,
        "confidence": 0.75,
        "updated_at": "2026-02-13"
      },
      "sub_category": {
        "source": "arxiv",
        "tier": 2,
        "confidence": 0.75,
        "updated_at": "2026-02-13"
      },
      "tags": {
        "source": "arxiv",
        "tier": 2,
        "confidence": 0.75,
        "updated_at": "2026-02-13"
      },
      "key_people": {
        "source": "arxiv",
        "tier": 2,
        "confidence": 0.75,
        "updated_at": "2026-02-13"
      },
      "release_date": {
        "source": "arxiv",
        "tier": 2,
        "confidence": 0.75,
        "updated_at": "2026-02-13"
      }
    }
  },
  "sources": [
    {
      "url": "http://arxiv.org/abs/2602.10735v1",
      "source_name": "arxiv",
      "scraped_at": "2026-02-13"
    }
  ],
  "company": {
    "name": "Calliope",
    "url": "https://www.bing.com/search?q=Calliope+AI"
  },
  "sub_category": "text-generation",
  "tags": [
    "researchers",
    "creators",
    "text-to-speech",
    "open-source",
    "research",
    "chatbot",
    "nlp"
  ],
  "key_people": [
    {
      "name": "Hugo L. Hammer",
      "title": "Author",
      "is_founder": false
    },
    {
      "name": "Vajira Thambawita",
      "title": "Author",
      "is_founder": false
    },
    {
      "name": "PÃ¥l Halvorsen",
      "title": "Author",
      "is_founder": false
    }
  ],
  "release_date": "2026-02-11"
}
