{
  "slug": "cerebras",
  "name": "Cerebras",
  "product_url": "",
  "description": "AI hardware company building the largest chip for deep learning training and inference",
  "product_type": "other",
  "category": "ai-application",
  "status": "active",
  "meta": {
    "added_date": "2026-02-13",
    "last_updated": "2026-02-14",
    "provenance": {
      "name": {
        "source": "wikidata",
        "tier": 1,
        "confidence": 0.95,
        "updated_at": "2026-02-13"
      },
      "description": {
        "source": "wikidata",
        "tier": 1,
        "confidence": 0.95,
        "updated_at": "2026-02-13"
      },
      "product_type": {
        "source": "wikidata",
        "tier": 1,
        "confidence": 0.95,
        "updated_at": "2026-02-13"
      },
      "category": {
        "source": "wikidata",
        "tier": 1,
        "confidence": 0.95,
        "updated_at": "2026-02-13"
      },
      "status": {
        "source": "wikidata",
        "tier": 1,
        "confidence": 0.95,
        "updated_at": "2026-02-13"
      },
      "company.name": {
        "source": "wikidata",
        "tier": 1,
        "confidence": 0.95,
        "updated_at": "2026-02-13"
      },
      "company.url": {
        "source": "wikidata",
        "tier": 1,
        "confidence": 0.95,
        "updated_at": "2026-02-13"
      },
      "company.wikipedia_url": {
        "source": "wikidata",
        "tier": 1,
        "confidence": 0.95,
        "updated_at": "2026-02-13"
      },
      "company.founded_year": {
        "source": "wikidata",
        "tier": 1,
        "confidence": 0.95,
        "updated_at": "2026-02-13"
      },
      "company.headquarters": {
        "source": "wikidata",
        "tier": 1,
        "confidence": 0.95,
        "updated_at": "2026-02-13"
      },
      "company.headquarters.city": {
        "source": "wikidata",
        "tier": 1,
        "confidence": 0.95,
        "updated_at": "2026-02-13"
      }
    }
  },
  "sources": [
    {
      "url": "https://www.wikidata.org/wiki/Q66604886",
      "source_name": "wikidata",
      "scraped_at": "2026-02-13"
    }
  ],
  "company": {
    "name": "Cerebras",
    "url": "https://en.wikipedia.org/wiki/Cerebras",
    "wikipedia_url": "https://en.wikipedia.org/wiki/Cerebras",
    "founded_year": 2016,
    "headquarters": {
      "city": "Sunnyvale"
    }
  },
  "tags": [
    "consumers"
  ]
}
