{
  "slug": "visual-reasoning-benchmark",
  "name": "Visual Reasoning Benchmark",
  "product_url": "",
  "description": "AI models have achieved state-of-the-art results in textual reasoning; however, their ability to reason over spatial and relational structures remains a critical bottleneck -- particularly in early-grade maths, which relies heavily on visuals. This paper introduces the visual reasoning benchmark (VRB), a novel dataset designed to evaluate Multimodal Large Language Models (MLLMs) on their ability to solve authentic visual problems from classrooms. This benchmark is built on a set of 701 questions sourced from primary school examinations in Zambia and India, which cover a range of tasks such as reasoning by analogy, pattern completion, and spatial matching. We outline the methodology and development of the benchmark which intentionally uses unedited, minimal-text images to test if models can meet realistic needs of primary education. Our findings reveal a ``jagged frontier'' of capability where models demonstrate better proficiency in static skills such as counting and scaling, but reach a distinct ``spatial ceiling'' when faced with dynamic operations like folding, reflection, and rotation. These weaknesses pose a risk for classroom use on visual reasoning problems, with the potential for incorrect marking, false scaffolding, and reinforcing student misconceptions. Consequently, education-focused benchmarks like the VRB are essential for determining the functional boundaries of multimodal tools used in classrooms.",
  "product_type": "llm",
  "category": "ai-foundation-model",
  "status": "active",
  "meta": {
    "added_date": "2026-02-13",
    "last_updated": "2026-02-13",
    "provenance": {
      "name": {
        "source": "arxiv",
        "tier": 2,
        "confidence": 0.75,
        "updated_at": "2026-02-13"
      },
      "description": {
        "source": "arxiv",
        "tier": 2,
        "confidence": 0.75,
        "updated_at": "2026-02-13"
      },
      "product_type": {
        "source": "arxiv",
        "tier": 2,
        "confidence": 0.75,
        "updated_at": "2026-02-13"
      },
      "category": {
        "source": "arxiv",
        "tier": 2,
        "confidence": 0.75,
        "updated_at": "2026-02-13"
      },
      "status": {
        "source": "arxiv",
        "tier": 2,
        "confidence": 0.75,
        "updated_at": "2026-02-13"
      },
      "company.name": {
        "source": "arxiv",
        "tier": 2,
        "confidence": 0.75,
        "updated_at": "2026-02-13"
      },
      "company.url": {
        "source": "arxiv",
        "tier": 2,
        "confidence": 0.75,
        "updated_at": "2026-02-13"
      },
      "sub_category": {
        "source": "arxiv",
        "tier": 2,
        "confidence": 0.75,
        "updated_at": "2026-02-13"
      },
      "tags": {
        "source": "arxiv",
        "tier": 2,
        "confidence": 0.75,
        "updated_at": "2026-02-13"
      },
      "key_people": {
        "source": "arxiv",
        "tier": 2,
        "confidence": 0.75,
        "updated_at": "2026-02-13"
      },
      "release_date": {
        "source": "arxiv",
        "tier": 2,
        "confidence": 0.75,
        "updated_at": "2026-02-13"
      }
    }
  },
  "sources": [
    {
      "url": "http://arxiv.org/abs/2602.12196v1",
      "source_name": "arxiv",
      "scraped_at": "2026-02-13"
    }
  ],
  "company": {
    "name": "Visual Reasoning Benchmark",
    "url": "https://www.bing.com/search?q=Visual+Reasoning+Benchmark+AI"
  },
  "sub_category": "text-generation",
  "tags": [
    "nlp",
    "research",
    "chatbot",
    "education-tutoring",
    "multimodal",
    "researchers"
  ],
  "key_people": [
    {
      "name": "Mohamed Huti",
      "title": "Author",
      "is_founder": false
    },
    {
      "name": "Alasdair Mackintosh",
      "title": "Author",
      "is_founder": false
    },
    {
      "name": "Amy Waldock",
      "title": "Author",
      "is_founder": false
    },
    {
      "name": "Dominic Andrews",
      "title": "Author",
      "is_founder": false
    },
    {
      "name": "Maxime Leli√®vre",
      "title": "Author",
      "is_founder": false
    }
  ],
  "release_date": "2026-02-12"
}
