{
  "slug": "towards-on-policy-sft",
  "name": "Towards On-Policy SFT",
  "product_url": "",
  "description": "Supervised fine-tuning (SFT) is computationally efficient but often yields inferior generalization compared to reinforcement learning (RL). This gap is primarily driven by RL's use of on-policy data. We propose a framework to bridge this chasm by enabling On-Policy SFT. We first present \\textbf{\\textit{Distribution Discriminant Theory (DDT)}}, which explains and quantifies the alignment between data and the model-induced distribution. Leveraging DDT, we introduce two complementary techniques: (i) \\textbf{\\textit{In-Distribution Finetuning (IDFT)}}, a loss-level method to enhance generalization ability of SFT, and (ii) \\textbf{\\textit{Hinted Decoding}}, a data-level technique that can re-align the training corpus to the model's distribution. Extensive experiments demonstrate that our framework achieves generalization performance on par with prominent offline RL algorithms, including DPO and SimPO, while maintaining the efficiency of an SFT pipeline. The proposed framework thus offers a practical alternative in domains where RL is infeasible. We open-source the code here: https://github.com/zhangmiaosen2000/Towards-On-Policy-SFT",
  "product_type": "other",
  "category": "ai-creative-media",
  "status": "active",
  "meta": {
    "added_date": "2026-02-13",
    "last_updated": "2026-02-13",
    "provenance": {
      "name": {
        "source": "arxiv",
        "tier": 2,
        "confidence": 0.75,
        "updated_at": "2026-02-13"
      },
      "description": {
        "source": "arxiv",
        "tier": 2,
        "confidence": 0.75,
        "updated_at": "2026-02-13"
      },
      "product_type": {
        "source": "arxiv",
        "tier": 2,
        "confidence": 0.75,
        "updated_at": "2026-02-13"
      },
      "category": {
        "source": "arxiv",
        "tier": 2,
        "confidence": 0.75,
        "updated_at": "2026-02-13"
      },
      "status": {
        "source": "arxiv",
        "tier": 2,
        "confidence": 0.75,
        "updated_at": "2026-02-13"
      },
      "company.name": {
        "source": "arxiv",
        "tier": 2,
        "confidence": 0.75,
        "updated_at": "2026-02-13"
      },
      "company.url": {
        "source": "arxiv",
        "tier": 2,
        "confidence": 0.75,
        "updated_at": "2026-02-13"
      },
      "sub_category": {
        "source": "arxiv",
        "tier": 2,
        "confidence": 0.75,
        "updated_at": "2026-02-13"
      },
      "tags": {
        "source": "arxiv",
        "tier": 2,
        "confidence": 0.75,
        "updated_at": "2026-02-13"
      },
      "key_people": {
        "source": "arxiv",
        "tier": 2,
        "confidence": 0.75,
        "updated_at": "2026-02-13"
      },
      "release_date": {
        "source": "arxiv",
        "tier": 2,
        "confidence": 0.75,
        "updated_at": "2026-02-13"
      }
    }
  },
  "sources": [
    {
      "url": "http://arxiv.org/abs/2602.12222v1",
      "source_name": "arxiv",
      "scraped_at": "2026-02-13"
    }
  ],
  "company": {
    "name": "Towards On-Policy SFT",
    "url": "https://www.bing.com/search?q=Towards+On-Policy+SFT+AI"
  },
  "sub_category": "image-generation",
  "tags": [
    "text-to-image",
    "fine-tuning",
    "creators",
    "diffusion-model",
    "open-source",
    "computer-vision",
    "research",
    "reinforcement-learning",
    "content-creation"
  ],
  "key_people": [
    {
      "name": "Miaosen Zhang",
      "title": "Author",
      "is_founder": false
    },
    {
      "name": "Yishan Liu",
      "title": "Author",
      "is_founder": false
    },
    {
      "name": "Shuxia Lin",
      "title": "Author",
      "is_founder": false
    },
    {
      "name": "Xu Yang",
      "title": "Author",
      "is_founder": false
    },
    {
      "name": "Qi Dai",
      "title": "Author",
      "is_founder": false
    }
  ],
  "release_date": "2026-02-12"
}
