{
  "slug": "iterait",
  "name": "Iterait",
  "product_url": "https://www.iterait.com/",
  "description": "Iterait is an AI product.",
  "product_type": "other",
  "category": "ai-application",
  "status": "active",
  "meta": {
    "added_date": "2026-02-13",
    "last_updated": "2026-02-13",
    "provenance": {
      "name": {
        "source": "wikidata",
        "tier": 1,
        "confidence": 0.95,
        "updated_at": "2026-02-13"
      },
      "product_url": {
        "source": "wikidata",
        "tier": 1,
        "confidence": 0.95,
        "updated_at": "2026-02-13"
      },
      "description": {
        "source": "wikidata",
        "tier": 1,
        "confidence": 0.95,
        "updated_at": "2026-02-13"
      },
      "product_type": {
        "source": "wikidata",
        "tier": 1,
        "confidence": 0.95,
        "updated_at": "2026-02-13"
      },
      "category": {
        "source": "wikidata",
        "tier": 1,
        "confidence": 0.95,
        "updated_at": "2026-02-13"
      },
      "status": {
        "source": "wikidata",
        "tier": 1,
        "confidence": 0.95,
        "updated_at": "2026-02-13"
      },
      "company.name": {
        "source": "wikidata",
        "tier": 1,
        "confidence": 0.95,
        "updated_at": "2026-02-13"
      },
      "company.url": {
        "source": "wikidata",
        "tier": 1,
        "confidence": 0.95,
        "updated_at": "2026-02-13"
      },
      "company.website": {
        "source": "wikidata",
        "tier": 1,
        "confidence": 0.95,
        "updated_at": "2026-02-13"
      },
      "company.founded_year": {
        "source": "wikidata",
        "tier": 1,
        "confidence": 0.95,
        "updated_at": "2026-02-13"
      },
      "company.headquarters": {
        "source": "wikidata",
        "tier": 1,
        "confidence": 0.95,
        "updated_at": "2026-02-13"
      },
      "company.headquarters.city": {
        "source": "wikidata",
        "tier": 1,
        "confidence": 0.95,
        "updated_at": "2026-02-13"
      },
      "company.headquarters.country": {
        "source": "wikidata",
        "tier": 1,
        "confidence": 0.95,
        "updated_at": "2026-02-13"
      }
    }
  },
  "sources": [
    {
      "url": "https://www.wikidata.org/wiki/Q107782381",
      "source_name": "wikidata",
      "scraped_at": "2026-02-13"
    }
  ],
  "company": {
    "name": "Iterait",
    "url": "https://www.iterait.com",
    "website": "https://www.iterait.com",
    "founded_year": 2018,
    "headquarters": {
      "city": "Prague",
      "country": "Czech Republic"
    }
  },
  "tags": [
    "europe",
    "consumers"
  ]
}
