{
  "slug": "787-10",
  "name": "787\\\\\n\\\\\n10",
  "product_url": "",
  "description": "787\\\\\n\\\\\n10 is an AI product.",
  "product_type": "llm",
  "category": "ai-foundation-model",
  "status": "active",
  "meta": {
    "added_date": "2026-02-14",
    "last_updated": "2026-02-15",
    "provenance": {
      "name": {
        "source": "theresanaiforthat",
        "tier": 2,
        "confidence": 0.75,
        "updated_at": "2026-02-14"
      },
      "description": {
        "source": "theresanaiforthat",
        "tier": 2,
        "confidence": 0.75,
        "updated_at": "2026-02-14"
      },
      "product_type": {
        "source": "theresanaiforthat",
        "tier": 2,
        "confidence": 0.75,
        "updated_at": "2026-02-14"
      },
      "category": {
        "source": "theresanaiforthat",
        "tier": 2,
        "confidence": 0.75,
        "updated_at": "2026-02-14"
      },
      "status": {
        "source": "theresanaiforthat",
        "tier": 2,
        "confidence": 0.75,
        "updated_at": "2026-02-14"
      },
      "company.name": {
        "source": "theresanaiforthat",
        "tier": 2,
        "confidence": 0.75,
        "updated_at": "2026-02-14"
      },
      "company.url": {
        "source": "theresanaiforthat",
        "tier": 2,
        "confidence": 0.75,
        "updated_at": "2026-02-14"
      },
      "sub_category": {
        "source": "theresanaiforthat",
        "tier": 2,
        "confidence": 0.75,
        "updated_at": "2026-02-14"
      },
      "tags": {
        "source": "theresanaiforthat",
        "tier": 2,
        "confidence": 0.75,
        "updated_at": "2026-02-15"
      }
    }
  },
  "sources": [
    {
      "url": "https://theresanaiforthat.com/s/text-generators",
      "source_name": "theresanaiforthat",
      "scraped_at": "2026-02-14"
    }
  ],
  "company": {
    "name": "787\\\\\n\\\\\n10",
    "url": "https://www.bing.com/search?q=787%5C%5C%0A%5C%5C%0A10+AI"
  },
  "sub_category": "text-generation",
  "tags": []
}
